{
  "schema": "ev4-builder-context-package@1.0.0",
  "source_stage": "/builder-feed-export",
  "source_handoff_stage": "/handoff-export",
  "package_status": "ready_with_visible_flags",
  "selected_candidate_id": "ARCH-FAM-C",
  "selected_candidate_locked": true,
  "production_ready_allowed": false,
  "source_payload_ledger": [{"payload_name": "CE Builder Executable Package", "schema": "ev4-builder-executable-package@1.0.0", "status": "available", "source_ref": "grid-fixture"}],
  "approved_structure_tree": [{"node_id": "n-001", "structure_label": "Smart Home Section / Root", "class_name": "smart-home__section--root", "element_type": "Container", "element_generation": "Shared compatibility element", "element_generation_source": "architect_export", "role": "root", "children": []}],
  "class_creation_application_map": [{"class_name": "smart-home__section--root", "related_structure_label": "Smart Home Section / Root", "elementor_node_or_element": "n-001", "when_to_create": "when creating root Container", "reusable_or_one_off": "section_scoped", "purpose": "section root scope", "css_needed_now": "no"}],
  "widget_mapping_table": [{"structure_label": "Smart Home Section / Root", "class_name": "smart-home__section--root", "recommended_widget_or_element": "Container", "editable_content": "none", "why_this_mapping": "Approved root wrapper."}],
  "editable_content_map": [{"content_role": "feature_card_title", "structure_label": "Feature Card / Title", "widget_or_element": "Heading Widget", "editability_status": "editable_text", "must_not_flatten": true}],
  "decoration_only_map": [{"decoration_role": "connector_lines", "structure_label": "Connector Layer / Association Lines", "class_name": "smart-home__section--root", "may_hide_or_simplify_on_responsive": true, "must_not_contain_meaningful_content": true}],
  "asset_replacement_map": [{"asset_role": "house_visual_core", "structure_label": "Visual Core / House Asset", "source_status": "unknown_asset_source", "replacement_needed": "yes_when_building_real_section", "alt_decision": "unresolved"}],
  "scoped_css_need_map": [{"class_or_scope": "smart-home__section--root", "css_need": "section_scoped_boundary_if_css_is_later_needed", "reason": "prevent global leakage", "native_elementor_alternative": "Elementor controls first", "css_allowed_now": "later", "risk": "low_fixture_only"}],
  "responsive_qa_seed": {"unresolved_breakpoints": ["tablet", "mobile"], "connector_behavior_status": "unresolved", "meaningful_content_visibility_rule": "do_not_hide_meaningful_content"},
  "forbidden_work": ["do_not_redesign", "do_not_rescore", "do_not_change_selected_candidate", "do_not_claim_production_ready"],
  "first_builder_batch": {"max_actions": 1, "actions": [{"action_id": "BATCH-001-A01", "target_element": "Smart Home Section / Root", "parent": "page root", "element_type": "Container", "element_generation": "Shared compatibility element", "element_generation_source": "architect_export", "structure_panel_name": "Smart Home Section / Root", "active_class": "smart-home__section--root", "instruction": "Create the root Container and stage the grid as explicit left and right Builder regions around the primary anchor.", "expected_result": "Root Container exists and preserves the left/right grid decomposition."}]},
  "confirmation_request": {"confirmation_id": "CONFIRM-BATCH-001", "confirmed_action_ids": ["BATCH-001-A01"], "expected_user_token": "تایید BATCH-001", "template_id": "standard_batch_confirmation"},
  "visual_reference_present": true,
  "visual_parity_expected": true,
  "task_type": "visual_build",
  "reference_artifact_type": "structured_contract",
  "reference_paradigm_lock": {"schema": "ev4-reference-paradigm-lock@1.0.0", "source_reference_id": "grid-fixture-001", "extracted_by": "constructability_engineer", "paradigm_locked": true, "layout_paradigm": "grid", "primary_anchor": "house-center", "distribution_model": "3-left-3-right", "repeated_unit_form": "pill-card", "connector_model": "card-edge-to-house-edge", "spatial_symmetry": "bilateral", "completion_signature": ["grid decomposed into left region", "grid decomposed into right region", "center house anchor"]},
  "paradigm_to_structure_map": {"primary_anchor": "house-center", "regions": ["left-feature-region (left side, 3)", "right-feature-region (right side, 3)", "house-center (center primary anchor)"], "repeated_units": ["pill-card", "pill-card with icon, title, subtitle"], "connector_layer": "connector-layer:card-edge-to-house-edge", "first_batch_requirements": {"must_establish_primary_anchor": true, "must_create_or_stage_left_right_regions": true, "must_use_repeated_unit_form": "pill-card", "forbidden_composition_starts": [], "connector_strategy": "card-edge-to-house-edge"}},
  "first_batch_structure_intent": {"primary_anchor_staged": true, "primary_anchor": "house-center", "distribution_model": "3-left-3-right", "repeated_unit_form": "pill-card", "region_model": "left-center-right", "left_region_count": 3, "right_region_count": 3, "connector_strategy": "card-edge-to-house-edge", "connector_layer_staged": true, "forbidden_composition_start": false}
}
