{
  "schema": "ev4-builder-context-package@1.0.0",
  "source_stage": "/builder-feed-export",
  "source_handoff_stage": "/handoff-export",
  "package_status": "ready_with_visible_flags",
  "selected_candidate_id": "ARCH-FAM-C",
  "selected_candidate_locked": true,
  "production_ready_allowed": false,
  "source_payload_ledger": [{"payload_name": "Handoff_Payload", "schema": "ev4-handoff-export-payload@1.0.0", "status": "available"}],
  "approved_structure_tree": [{"node_id": "n-001", "structure_label": "Smart Home Section / Root", "class_name": "smart-home__section--root", "element_type": "Container", "element_generation": "Shared compatibility element", "element_generation_source": "architect_export", "role": "root", "children": []}],
  "class_creation_application_map": [{"class_name": "smart-home__section--root", "related_structure_label": "Smart Home Section / Root", "elementor_node_or_element": "n-001", "when_to_create": "when creating root Container", "reusable_or_one_off": "section_scoped", "purpose": "section root scope", "css_needed_now": "no"}],
  "widget_mapping_table": [{"structure_label": "Smart Home Section / Root", "class_name": "smart-home__section--root", "recommended_widget_or_element": "Container", "editable_content": "none", "why_this_mapping": "Root wrapper."}],
  "editable_content_map": [],
  "decoration_only_map": [],
  "asset_replacement_map": [],
  "scoped_css_need_map": [],
  "responsive_qa_seed": {"unresolved_breakpoints": ["tablet", "mobile"], "connector_behavior_status": "unresolved", "meaningful_content_visibility_rule": "do_not_hide_meaningful_content"},
  "forbidden_work": ["do_not_redesign"],
  "first_builder_batch": {"max_actions": 1, "actions": [{"action_id": "BATCH-001-A01", "target_element": "Smart Home Section / Root", "element_generation": "Shared compatibility element", "element_generation_source": "architect_export", "instruction": "Create root.", "expected_result": "Root exists."}]},
  "confirmation_request": {"confirmation_id": "CONFIRM-BATCH-001", "confirmed_action_ids": ["BATCH-001-A01"], "expected_user_token": "تایید BATCH-001", "template_id": "standard_batch_confirmation"}
}
