{
  "schema": "ev4-builder-context-package@1.0.0",
  "source_stage": "/builder-feed-export",
  "source_handoff_stage": "/handoff-export",
  "package_status": "ready_with_visible_flags",
  "selected_candidate_id": "ARCH-FAM-C",
  "selected_candidate_locked": true,
  "production_ready_allowed": false,
  "source_payload_ledger": [
    {
      "payload_name": "Handoff_Payload",
      "schema": "ev4-handoff-export-payload@1.0.0",
      "status": "available",
      "source_ref": "no-connector-test-fixture"
    }
  ],
  "approved_structure_tree": [
    {
      "node_id": "n-001",
      "structure_label": "Smart Home Section / Root",
      "class_name": "smart-home__section--root",
      "element_type": "Container",
      "element_generation": "Shared compatibility element",
      "element_generation_source": "architect_export",
      "role": "root",
      "children": []
    }
  ],
  "class_creation_application_map": [
    {
      "class_name": "smart-home__section--root",
      "related_structure_label": "Smart Home Section / Root",
      "elementor_node_or_element": "n-001",
      "when_to_create": "when creating root Container",
      "reusable_or_one_off": "section_scoped",
      "purpose": "section root scope",
      "css_needed_now": "no",
      "notes_or_unknowns": "No connector layer required in this regression fixture."
    }
  ],
  "widget_mapping_table": [
    {
      "structure_label": "Smart Home Section / Root",
      "class_name": "smart-home__section--root",
      "recommended_widget_or_element": "Container",
      "editable_content": "none",
      "why_this_mapping": "Root wrapper from approved build tree.",
      "unknowns": []
    }
  ],
  "editable_content_map": [],
  "decoration_only_map": [],
  "asset_replacement_map": [],
  "scoped_css_need_map": [],
  "responsive_qa_seed": {
    "unresolved_breakpoints": [
      "tablet",
      "mobile"
    ],
    "connector_behavior_status": "not_required",
    "meaningful_content_visibility_rule": "do_not_hide_meaningful_content",
    "notes": "No connector layer is expected in this regression fixture."
  },
  "audit_flags_to_preserve": [],
  "unknowns_to_preserve": [
    "mobile/tablet screenshot absent"
  ],
  "forbidden_work": [
    "do_not_redesign",
    "do_not_rescore",
    "do_not_change_selected_candidate",
    "do_not_claim_production_ready"
  ],
  "first_builder_batch": {
    "max_actions": 1,
    "actions": [
      {
        "action_id": "BATCH-001-A01",
        "target_element": "Smart Home Section / Root",
        "parent": "page root",
        "element_type": "Container",
        "element_generation": "Shared compatibility element",
        "element_generation_source": "architect_export",
        "structure_panel_name": "Smart Home Section / Root",
        "active_class": "smart-home__section--root",
        "instruction": "Create the root Container and stage the left-center-right structure without a connector layer.",
        "properties_not_to_change": [
          "selected_candidate_id",
          "approved architecture"
        ],
        "expected_result": "Root exists and no connector layer is staged."
      }
    ]
  },
  "confirmation_request": {
    "confirmation_id": "CONFIRM-BATCH-001",
    "confirmed_action_ids": [
      "BATCH-001-A01"
    ],
    "expected_user_token": "تایید BATCH-001",
    "template_id": "standard_batch_confirmation"
  },
  "visual_reference_present": true,
  "visual_parity_expected": true,
  "task_type": "visual_build",
  "reference_artifact_type": "structured_contract",
  "reference_paradigm_lock": {
    "schema": "ev4-reference-paradigm-lock@1.0.0",
    "source_reference_id": "no-connector-reference-001",
    "extracted_by": "constructability_engineer",
    "paradigm_locked": true,
    "layout_paradigm": "center-anchored-symmetric",
    "primary_anchor": "house-center",
    "distribution_model": "3-left-3-right",
    "repeated_unit_form": "pill-card",
    "connector_model": "none",
    "spatial_symmetry": "bilateral",
    "completion_signature": [
      "center house anchor",
      "three left pill cards",
      "three right pill cards",
      "no connectors"
    ]
  },
  "paradigm_to_structure_map": {
    "primary_anchor": "house-center",
    "regions": [
      "left feature region",
      "center house anchor region",
      "right feature region"
    ],
    "repeated_units": [
      "left pill cards",
      "right pill cards"
    ],
    "connector_layer": "none",
    "first_batch_requirements": {
      "must_establish_primary_anchor": true,
      "must_create_or_stage_left_right_regions": true,
      "must_use_repeated_unit_form": "pill-card",
      "connector_strategy": "none",
      "forbidden_composition_starts": [
        "single vertical feature group",
        "vertical feature list",
        "floating text/icon units"
      ]
    }
  },
  "first_batch_structure_intent": {
    "primary_anchor_staged": true,
    "primary_anchor": "house-center",
    "distribution_model": "3-left-3-right",
    "repeated_unit_form": "pill-card",
    "region_model": "left-center-right",
    "left_region_count": 3,
    "right_region_count": 3,
    "connector_strategy": "none",
    "connector_layer_staged": false,
    "forbidden_composition_start": false
  }
}
